<?xml version="1.0" encoding="UTF-8"?>
<!-- edited with XMLSPY v2004 rel. 3 U (http://www.xmlspy.com) by Robert Kurowski (SCS) -->
<xs:schema xmlns:xs="http://www.w3.org/2001/XMLSchema" elementFormDefault="qualified" attributeFormDefault="unqualified">
	<xs:element name="message">
		<xs:annotation>
			<xs:documentation>Description of a fixed length string MQ message</xs:documentation>
		</xs:annotation>
		<xs:complexType>
			<xs:sequence>
				<xs:element name="fieldDefinitions">
					<xs:annotation>
						<xs:documentation>All field declarations for this message type</xs:documentation>
					</xs:annotation>
					<xs:complexType>
						<xs:sequence>
							<xs:element name="defineField" maxOccurs="unbounded">
								<xs:complexType>
									<xs:sequence>
										<xs:element name="valid" minOccurs="0" maxOccurs="unbounded">
											<xs:annotation>
												<xs:documentation>global valid values for this field</xs:documentation>
											</xs:annotation>
											<xs:complexType>
												<xs:attribute name="value" type="xs:string" use="required"/>
											</xs:complexType>
										</xs:element>
									</xs:sequence>
									<xs:attribute name="name" type="xs:string" use="required"/>
									<xs:attribute name="length" type="xs:integer" use="required"/>
									<xs:attribute name="type" type="xs:string" use="optional"/>
									<xs:attribute name="format" type="xs:string" use="optional"/>
								</xs:complexType>
							</xs:element>
						</xs:sequence>
					</xs:complexType>
				</xs:element>
				<xs:element name="header">
					<xs:complexType>
						<xs:sequence>
							<xs:element name="field" maxOccurs="unbounded">
								<xs:complexType>
									<xs:attribute name="name" type="xs:string" use="required"/>
									<xs:attribute name="optional" type="xs:boolean" use="required"/>
								</xs:complexType>
							</xs:element>
						</xs:sequence>
					</xs:complexType>
				</xs:element>
				<xs:element name="tag" maxOccurs="unbounded">
					<xs:complexType>
						<xs:sequence>
							<xs:element name="field" maxOccurs="unbounded">
								<xs:complexType>
									<xs:sequence>
										<xs:element name="valid" minOccurs="0" maxOccurs="unbounded">
											<xs:annotation>
												<xs:documentation>local valid values for this field</xs:documentation>
											</xs:annotation>
											<xs:complexType>
												<xs:attribute name="value" type="xs:string" use="required"/>
											</xs:complexType>
										</xs:element>
									</xs:sequence>
									<xs:attribute name="name" type="xs:string" use="required"/>
									<xs:attribute name="optional" type="xs:boolean" use="required"/>
								</xs:complexType>
							</xs:element>
							<xs:element name="child" minOccurs="0" maxOccurs="unbounded">
								<xs:complexType>
									<xs:attribute name="name" type="xs:string" use="required"/>
								</xs:complexType>
							</xs:element>
						</xs:sequence>
						<xs:attribute name="name" type="xs:string" use="required"/>
						<xs:attribute name="level" type="xs:integer" use="required"/>
					</xs:complexType>
				</xs:element>
			</xs:sequence>
			<xs:attribute name="msgId" type="xs:string" use="required"/>
			<xs:attribute name="version" type="xs:string" use="required"/>
			<xs:attribute name="validate" type="xs:string" use="optional"/>
		</xs:complexType>
	</xs:element>
</xs:schema>
